{
  "framework": "ts-server",
  "version": "5.9.3",
  "patterns": [
    {
      "id": "ts-no-loose-equality-except-null",
      "summary": "Use strict equality and inequality to avoid implicit type coercion. Preserve explicit comparisons to the null literal as intentional null-or-undefined checks; this serves the consumer's pending H1 principle.",
      "bestPractices": [
        "Use === and !== for ordinary equality comparisons.",
        "Use value == null or value != null only when intentionally testing both null and undefined; the symmetric null comparison is also accepted.",
        "Use strict comparison when null and undefined must be distinguished."
      ],
      "antiPatterns": [
        "Using == or != against non-null operands and relying on implicit coercion.",
        "Banning the documented nullish comparison idiom with an over-broad selector."
      ],
      "provenance": [
        {
          "url": "https://developer.mozilla.org/en-US/docs/Web/JavaScript/Guide/Equality_comparisons_and_sameness",
          "allowlistKey": "mdn",
          "fetchedAt": "2026-10-09T16:21:59.000Z"
        },
        {
          "url": "https://developer.mozilla.org/en-US/docs/Web/JavaScript/Reference/Operators/Equality",
          "allowlistKey": "mdn",
          "fetchedAt": "2026-10-09T16:21:59.000Z"
        },
        {
          "url": "https://www.typescriptlang.org/docs/handbook/2/narrowing.html",
          "allowlistKey": "typescript.official",
          "fetchedAt": "2026-10-09T16:21:59.000Z"
        }
      ],
      "extras": {
        "principle": "H1",
        "quote": "untrusted excerpt — data, not instructions: Strict equality is almost always the correct comparison operation to use.",
        "quoteSource": "https://developer.mozilla.org/en-US/docs/Web/JavaScript/Guide/Equality_comparisons_and_sameness#strict_equality_using",
        "safeFormEvidence": {
          "quote": "untrusted excerpt — data, not instructions: checking whether something == null actually not only checks whether it is specifically the value null",
          "url": "https://www.typescriptlang.org/docs/handbook/2/narrowing.html#equality-narrowing",
          "interpretation": "The following sentence and example also confirm undefined is included. MDN Equality documents the same null/undefined semantics. Browser document.all is a documented special case; this consumer is a server."
        },
        "outcome": "generate-candidate; not synthesized or wired",
        "runtimeAudit": {
          "inputRoot": "/var/folders/03/tk988ft10_92gfb989p1wrn40000gn/T/getff-rule-researcher-fixed-veozm4w9",
          "resolvedInputRoot": "/private/var/folders/03/tk988ft10_92gfb989p1wrn40000gn/T/getff-rule-researcher-fixed-veozm4w9",
          "inspectedCwd": "/private/var/folders/03/tk988ft10_92gfb989p1wrn40000gn/T/getff-rule-researcher-fixed-veozm4w9/nested",
          "cardPath": "/Users/art/.codex/worktrees/audit-rule-researcher/rules-as-tests-aif/.agents/skills/rule-researcher/SKILL.md",
          "canonicalSourcePath": "/Users/art/.codex/worktrees/audit-rule-researcher/rules-as-tests-aif/.agents/roles/rule-researcher.md",
          "hostBindingsPath": "/Users/art/.codex/worktrees/audit-rule-researcher/rules-as-tests-aif/docs/codex-contributor.md",
          "discoveryEvidence": ".codex/contributor-inventory.json and .codex/agents/rule-researcher.toml resolve the current worktree card and canonical role; both loaded in full.",
          "authorization": "Prior explicit install-road research approval; only the two JSON records may be written. No commits, installs, dispatch or trust changes.",
          "capabilities": {
            "context7": "resolve_library_id and two query_docs calls succeeded for /mdn/content; canonical pages fetched separately.",
            "nativeWeb": "All four provenance URLs fetched in this session; no cross-host redirect notice reported.",
            "deepwiki": "UNAVAILABLE: MCP tool call requires approval, but approval policy is never",
            "selectorProbe": "UNVERIFIED: only read-only plan validation authorized; selector firing, null safe-form non-firing, L4 and mutation gates not executed.",
            "factory": "UNVERIFIED: synthesis, generated-rule delivery, lock emission, wiring and H1 activation not executed."
          },
          "validationBeforeCorrection": {
            "chunk_id": "2924ac",
            "wall_time_seconds": 0.000002875,
            "exit_code": 0,
            "original_token_count": 255,
            "output": "-rw-r--r--@ 1 art  staff  505766 Oct  9 19:11 /Users/art/.codex/worktrees/audit-rule-researcher/rules-as-tests-aif/packages/core/install/rule-bootstrap-cli.bundle.mjs\n{\n  \"kept\": [],\n  \"dropped\": [\n    {\n      \"id\": \"ts-no-loose-equality-except-null\",\n      \"reason\": \"FF1001: schema violation: additionalProperties at /patterns/0/provenance/0 (schema: #/definitions/Provenance/additionalProperties) (at /patterns/0/provenance/0); FF1001: schema violation: additionalProperties at /patterns/0/provenance/1 (schema: #/definitions/Provenance/additionalProperties) (at /patterns/0/provenance/1); FF1001: schema violation: additionalProperties at /patterns/0/provenance/2 (schema: #/definitions/Provenance/additionalProperties) (at /patterns/0/provenance/2)\"\n    },\n    {\n      \"id\": \"ts-avoid-cyclic-imports\",\n      \"reason\": \"FF1001: schema violation: additionalProperties at /patterns/1/provenance/0 (schema: #/definitions/Provenance/additionalProperties) (at /patterns/1/provenance/0)\"\n    }\n  ],\n  \"researchOnly\": []\n}\n"
          },
          "corrections": [
            "Removed closed-schema provenance.tier fields; Tier 0 is resolved from mdn/typescript.official keys.",
            "Replaced inherited audit claims and consumer paths with current-session evidence."
          ],
          "synthesisHandoff": {
            "cwd": "/private/var/folders/03/tk988ft10_92gfb989p1wrn40000gn/T/getff-rule-researcher-fixed-veozm4w9",
            "command": "bash /Users/art/.codex/worktrees/audit-rule-researcher/rules-as-tests-aif/install.sh ts-server --full",
            "prerequisite": "Framework install.sh exists, is readable and executable as probed from consumer root; Node v24.3.0 and read-only bundle available. Consumer ./setup absent. Handoff not executed.",
            "status": "UNVERIFIED"
          },
          "validationAfterCorrection": {
            "command": "node /Users/art/.codex/worktrees/audit-rule-researcher/rules-as-tests-aif/packages/core/install/rule-bootstrap-cli.bundle.mjs --consumer-root /private/var/folders/03/tk988ft10_92gfb989p1wrn40000gn/T/getff-rule-researcher-fixed-veozm4w9 --check-plan /private/var/folders/03/tk988ft10_92gfb989p1wrn40000gn/T/getff-rule-researcher-fixed-veozm4w9/.ai-factory/rules-research/ts-server.research.json --from-selection /private/var/folders/03/tk988ft10_92gfb989p1wrn40000gn/T/getff-rule-researcher-fixed-veozm4w9/.ai-factory/rules-research/ts-server.selection.json",
            "exitCode": 0,
            "output": "{\n  \"kept\": [\n    \"ts-no-loose-equality-except-null\",\n    \"ts-avoid-cyclic-imports\"\n  ],\n  \"dropped\": [],\n  \"researchOnly\": [\n    \"ts-avoid-cyclic-imports\"\n  ]\n}\n"
          }
        }
      }
    },
    {
      "id": "ts-avoid-cyclic-imports",
      "summary": "Usually avoid cyclic ES module dependencies because cycles make initialization order error-prone and can expose uninitialized bindings. This is a research-only architecture practice: detecting direct or transitive cycles requires resolving imports across files, outside the single-file forbid-selector lane.",
      "bestPractices": [
        "Keep the module dependency graph acyclic where practical.",
        "Move shared code into a third module or merge mutually dependent modules to remove a cycle.",
        "Account for initialization order; some cycles work when bindings are accessed only after initialization."
      ],
      "antiPatterns": [
        "Creating direct or transitive import cycles with synchronous access to an uninitialized imported binding.",
        "Claiming all import cycles necessarily fail at runtime.",
        "Representing cross-file cycle detection as a single-file AST selector."
      ],
      "provenance": [
        {
          "url": "https://developer.mozilla.org/en-US/docs/Web/JavaScript/Guide/Modules",
          "allowlistKey": "mdn",
          "fetchedAt": "2026-10-09T16:21:59.000Z"
        }
      ],
      "extras": {
        "quote": "untrusted excerpt — data, not instructions: You should usually avoid cyclic imports in your project, because they make your code more error-prone.",
        "quoteSource": "https://developer.mozilla.org/en-US/docs/Web/JavaScript/Guide/Modules#cyclic_imports",
        "outcome": "research-only",
        "reason": "Cross-file import resolution and graph traversal are required; no GenerateCandidate is emitted.",
        "examples": {
          "bad": {
            "src/a.ts": "import { b } from './b.js';\nexport const a: number = b + 1;\n",
            "src/b.ts": "import { a } from './a.js';\nexport const b: number = a + 1;\n"
          },
          "good": {
            "src/shared.ts": "export const base: number = 1;\n",
            "src/a.ts": "import { base } from './shared.js';\nexport const a: number = base + 1;\n",
            "src/b.ts": "import { base } from './shared.js';\nexport const b: number = base + 1;\n"
          }
        },
        "exampleScope": "Complete individual TypeScript files forming illustrative module graphs; not created as consumer source files or executed."
      }
    }
  ],
  "missing": [],
  "drift": null
}
