{
  "framework": null,
  "version": null,
  "patterns": [],
  "missing": [
    "@opentelemetry/api",
    "@playwright/test",
    "vitest",
    "@storybook/nextjs",
    "@storybook/nextjs-vite",
    "tailwindcss"
  ],
  "drift": {
    "sources": [
      ".agents/procedures/getff/SKILL.md",
      ".agents/procedures/getff/references/overview.md",
      ".agents/procedures/getff/references/ai-traps.md"
    ],
    "mismatches": []
  }
}
